"entry_type","title","cdt_code","description"
"Procedure","interim completedenture(mandibular)",5811,
"Procedure","interim partial denture (maxillary)",5820,
"Procedure","interim partial denture (mandibular)",5821,
"Procedure","tissue conditioning, maxillary",5850,
"Procedure","tissue conditioning, mandibular",5851,
"Procedure","precision attachment, by report",5862,
"Procedure","overdenture complete maxillary D5864",5863,"overdenture partial maxillary D5865"
"Procedure","overdenture partial mandibular",5866,
"Procedure","replacement of replaceable part of semi-precision or precision attachment (male or female component)",5867,
"Procedure","modification of removable prosthesis following implant surgery",5875,"Attachment assemblies are reported using separate codes."
"Procedure","unspecified removable prosthodontic procedure, by report",5899,"Use for a procedure that is not adequately described by a code. Describe procedure."
"Procedure","facial moulage (sectional)",5911,"A sectional facial moulage impression is a procedureused to record the soft tissue contours of a portion of the face. Occasionally several separate sectional impressions are made, and then reassembled to provide a full facial contour cast. The impression is utilized to create a partial facial moulage and generally is not reusable."
"Procedure","facial moulage (complete)",5912,"Synonymous terminology: facial impression, face mask impression.A complete facial moulage impression is a procedure used to record the soft tissue contours of the whole face The impression is utilized to create a facial moulage and generally Is not reusable."
"Procedure","nasal prosthesis",5913,"Synonymous terminology: artificial nose.A removable prosthesis attached to the skin, which artificially restores part or all of the nose. Fabrication of a nasal prosthesis requires creation of an original mold. Additional prostheses usually can be made from thesame mold, and assuming no further tissue changes occur, the same mold can be utilized for extended periods of time.When a new prosthesis is made from the existing mold, this procedure is termed a nasal prosthesis replacement"
"Procedure","auricular prosthesis",5914,"Synonymous terminology: artificial ear, ear prosthesis.A removable prosthesis, which artificially restores part or all of the natural ear. Usually, replacement prostheses can be made from the original mold if tissue bed changes have not occurred. Creation of an auricular prosthesis requires fabrication of a mold, from which additional prostheses usually can be made, as needed later (auricular prosthesis, replacement)."
"Procedure","orbital prosthesi",5915,"A prosthesis, which artificially restores the eye, eyelids, and adjacent hard and soft tissue, lost as a result of trauma or surgery.Fabrication of an orbital prosthesis requires creation of an original mold. Additional prostheses usually can be made from the same mold, and assuming no further tissue changes occur, the same mold can be utilized for extended periods of time.When a new prosthesis is made from the existing mold, this procedure is termed an orbital prosthesis replacement."
"Procedure","ocular prosthesis",5916,"Synonymous terminology: artificial eye, glass eye.A prosthesis, which artificially replaces an eye missing as a result of trauma, surgery or congenital absence. The prosthesis does not replace missing eyelids or adjacent skin, mucosa or muscle.Ocular prostheses require semiannual or annual cleaning and polishing. Also, occasional revisions to re-adapt the prosthesis to the tissue bed may be necessary. Glass eyes are rarely made and cannot be re-adapted."
"Procedure","facial prosthesis",5919,"Synonymous terminology: prosthetic dressing.A removable prosthesis, which artificially replaces a portion of the face, lost due to surgery, trauma or congenital absence.Flexion of natural tissues may preclude adaptation and movement of the prosthesis to match the adjacent skin. Salivary leakage, when communicating with the oral cavity, adversely affects retention."
"Procedure","nasal septal prosthesis",5922,"Synonymous terminology: Septal plug, septal button.Removable prosthesis to occlude (obturate) a hole within the nasal septal wall. Adverse chemical degradation in this moist environment may require frequent replacement. Silicone prostheses are occasionally subject to fungal invasion."
"Procedure","ocular prosthesis, interim",5923,"Synonymous terminology: Eye shell, shell, ocular conformer, conformer.A temporary replacement generally made of clear acrylic resin for an eye lost due to surgery or trauma. No attempt is made to re-establish esthetics. Fabrication of an interim ocular prosthesis generally implies subsequent fabrication of an aesthetic ocular prosthesis."
"Procedure","cranial prosthesis",5924,"Synonymous terminology: Skull plate, cranioplasty prosthesis, cranial implant.A biocompatible, permanently implanted replacement of a portion of the skull bones; an artificial replacement for a portion of the skull bone."
"Procedure","facial augmentation implant prosthesis",5925,"Synonymous terminology: facial implant.An implantable biocompatible material generally onlayed upon an existing bony area beneath the skin tissue to fill in or collectively raise portions of the overlaying facial skin tissues to create acceptable contours.Although some forms of pre-made surgical implants are commercially available, the facial augmentation is usually custom made for surgical implantation for each individual patient due to the irregular or extensive nature of the facial deficit."
"Procedure","nasal prosthesis, replacement",5926,"Synonymous terminology: replacement nose.An artificial nose produced from a previously made mold. A replacement prosthesis does not require fabrication of a new mold. Generally, several prostheses can be made from the same mold assuming no changes occur in the tissue bed due to surgery or age related topographical variations."
"Procedure","auricular prosthesis, replacement",5927,"Synonymous terminology: replacement ear.An artificial ear produced from a previously made mold. A replacement prosthesis does not require fabrication of a new mold. Generally, several prostheses can be made from the same mold assuming no changes occur in the tissue bed due to surgery or age related topographical variations."
"Procedure","orbital prosthesis, replacement",5928,"A replacement for a previously made orbital prosthesis. A replacement prosthesis does not require fabrication of a new mold. Generally, several prostheses can be made from the same mold assuming no changes occur in the tissue bed due to surgery or age related topographical variations."
"Procedure","facial prosthesis, replacement",5929,"A replacement facial prosthesis made from the original mold.A replacement prosthesis does not require fabrication of a new mold. Generally, several prostheses can be made from the same mold assuming no changes occur in the tissue bed due to further surgery or age related topographical variations."
"Procedure","obturator prosthesis, surgical",5931,"Synonymous terminology: Obturator, surgical stayplate, immediate temporary obturator.A temporary prosthesis inserted during or immediately following surgical or traumatic loss of a portion or all of one or both maxillary bones and contiguous alveolar structures (e.g., gingival tissue, teeth).Frequent revisions of surgical obturators are necessary during the ensuing healing phase (approximately six months). Some dentists prefer to replace many or all teeth removed by the surgical procedure in the surgical obturator, while others do not replace any teeth. Further surgical revisions may require fabrication of another surgical obturator (e.g., an initially planned small defect may be revised and greatly enlarged after the final pathology report indicates margins are not free of tumor)."
"Procedure","obturator prosthesis, definitive",5932,"Synonymous terminology: obturatorA prosthesis, which artificially replaces part or all of the maxilla and associated teeth, lost due to surgery, trauma or congenital defects.A definitive obturator is made when it is deemed that further tissue changes or recurrence of tumor are unlikely and a more permanent prosthetic rehabilitation can be achieved; it is intended for long-term use."
"Procedure","obturator prosthesis, modification",5933,"Synonymous terminology: adjustment, denture adjustment, temporary or office reline.Revision or alteration of an existing obturator (surgical, interim, or definitive); possible modifications include relief of the denture base due to tissue compression, augmentation of the seal or peripheral areas to effect adequate sealing or separation between the nasal and oral cavities."
"Procedure","mandibular resection prosthesis with guide flange",5934,"Synonymous terminology: resection device, resection appliance.A prosthesis which guides the remaining portion of the mandible, left after a partial resection, into a more normal relationship with the maxilla. This allows for some tooth-to-tooth or an improved tooth contact. It may also artificially replace missing teeth and thereby increase masticatory efficiency."
"Procedure","mandibular resection prosthesis without guide flange",5935,"A prosthesis which helps guide the partially resected mandible to a more normal relation with the maxilla allowing for increased tooth contact. It does not have a flange or ramp, however, to assist in directional closure. It may replace missing teeth and thereby increase masticatory efficiency.Dentists who treat mandibulectomy patients may prefer to replace some, all or none of the teeth in the defect area. Frequently, the defects margins preclude even partial replacement. Use of a guide (a mandibular resection prosthesis with a guide flange) may not be possible due to anatomical limitations or poor patient tolerance. Ramps, extended occlusal arrangements and irregular occlusal positioning relative to the denture foundation frequently preclude stability of the prostheses, and thus some prostheses are poorly tolerated under such adverse circumstances."
"Procedure","obturator prosthesis, interim",5936,"Synonymous terminology: immediate postoperative obturator.A prosthesis which is made following completion of the initial healing after a surgical resection of a portion or all of one or both the maxillae; frequently many or all teeth in the defect area are replaced by this prosthesis. This prosthesis replaces the surgical obturator, which is usually inserted at, or immediately following the resection.Generally, an interim obturator is made to facilitate closure of the resultant defect after initial healing has been completed. Unlike the surgical obturator, which usually is made prior to surgery and frequently revised in the operating room during surgery, the interim obturator is made when the defect margins are clearly defined and further surgical revisions are not planned. It is a provisional prosthesis, which may replace some or all lost teeth, and other lost bone and soft tissue structures. Also, it frequently must be revised (termed an obturator prosthesis modification) during subsequent dental procedures (e.g., restorations, gingival surgery) as well as to compensate for further tissue shrinkage before a definitive obturator prosthesis is made."
"Procedure","trismus appliance (not for TMD treatment)",5937,"Synonymous terminology: occlusal device for mandibular trismus, dynamic bite opener.A prosthesis, which assists the patient in increasing their oral aperture width in order to eat as well as maintain oral hygiene.Several versions and designs are possible, all intending to ease the severe lack of oral opening experienced by many patients immediately following extensive intraoral surgical procedures."
"Procedure","feeding aid",5951,"Synonymous terminology: feeding prosthesis.A prosthesis, which maintains the right and left maxillary segments of an infant cleft palate patient in their properorientation until surgery is performed to repair the cleft. It closes the oral-nasal cavity defect, thus enhancing sucking and swallowing.Used on an interim basis, this prosthesis achieves separation of the oral and nasal cavities in infants born with wide clefts necessitating delayed closure. It is eliminated if surgical closure can be effected or, alternatively, with eruption of the deciduous dentition a pediatric speech aid may be made to facilitate closure of the defect."
"Procedure","speech aid prosthesis, pediatric",5952,"Synonymous terminology: nasopharyngeal obturator, speech appliance, obturator, cleft palate appliance, prosthetic speech aid, speech bulb.A temporary or interim prosthesis used to close a defect in the hard and/or soft palate. It may replace tissue lost due to developmental or surgical alterations. It is necessary for the production of intelligible speech.Normal lateral growth of the palatal bones necessitates occasional replacement of this prosthesis. Intermittent revisions of the obturator section can assist in maintenance of palatalpharyngeal closure (termed a speech aid prosthesis modification). Frequently, such prostheses are not fabricated before the deciduous dentition is fully erupted since clasp retention is often essential."
"Procedure","speech aid prosthesis, adult",5953,"Synonymous terminology: prosthetic speech appliance, speech aid, speech bulb.A definitive prosthesis, which can improve speech in adult cleft palate patients either by obturating (sealing off) a palatal cleft or fistula, or occasionally by assisting an incompetent soft palate. Both mechanisms are necessary to achieve velopharyngeal competency. Generally, this prosthesis is fabricated when no further growth is anticipated and the objective is to achievelong-term use. Hence, more precise materials and techniques are utilized. Occasionally such procedures are accomplished in conjunction with precision attachments in crown work undertaken on some or all maxillary teeth to achieve improved aesthetics"
"Procedure","palatal augmentation prosthesis",5954,"Synonymous terminology: superimposed prosthesis, maxillary glossectomy prosthesis, maxillary speech prosthesis, palatal drop prosthesis.A removable prosthesis which alters the hard and/or soft palates topographical form adjacent to the tongue."
"Procedure","palatal lift prosthesis, definitive",5955,"A prosthesis which elevates the soft palate superiorly and aids in restoration of soft palate functions which maybe lost due to an acquired, congenital or developmental defect.A definitive palatal lift is usually made for patients whose experience with an interim palatal lift has been successful, especially if surgical alterations are deemed unwarranted."
"Procedure","palatal lift prosthesis, interim",5958,"Synonymous terminology: diagnostic palatal lift.A prosthesis which elevates and assists in restoring soft palate function which may be lost due to clefting, surgery, trauma or unknown paralysis. It is intended for interim use to determine its usefulness in achieving palatalpharyngeal competency or enhance swallowing.This prosthesis is intended for interim use as a diagnostic aid to assess the level of possible improvement in speech intelligibility. Some clinicians believe use of a palatal lift on an interim basis may stimulate an otherwise flaccid soft palate to increase functional activity, subsequently lessening its need"
"Procedure","palatal lift prosthesis, modification",5959,"Synonymous terminology: revision of lift, adjustment.Alterations in the adaptation, contour, form or function of an existing palatal lift necessitated due to tissue impingement, lack of function, poor clasp adaptation or the like."
"Procedure","speech aid prosthesis, modification",5960,"Synonymous terminology: adjustment, repair, revision.Any revision of a pediatric or adult speech aid not necessitating its replacement.Frequently, revisions of the obturating section of any speech aid are required to facilitate enhanced speech intelligibility. Such revisions or repairs do not require complete remaking of the prosthesis, thus extending its longevity."
"Procedure","surgical stent",5982,"Synonymous terminology: periodontal stent, skin graft stent, columellar stent.Stents are utilized to apply pressure to soft tissues to facilitate healing and prevent cicatrization or collapse.A surgical stent may be required in surgical and postsurgical revisions to achieve close approximation of tissues. Usually such materials as temporary or interim soft denture liners, gutta percha, or dental modeling impression compound may be used."
"Procedure","radiation carrier",5983,"Synonymous terminology: radiotherapy prosthesis, carrier prosthesis, radiation applicator, radium carrier, intracavity carrier, intracavity applicator.A device used to administer radiation to confined areas by means of capsules, beads or needles of radiation emitting materials such as radium or cesium. Its function is to hold the radiation source securely in the same loca-tion during the entire period of treatment.Radiation oncologists occasionally request these devices to achieve close approximation and controlled application of radiation to a tumor deemed amiable to eradication."
"Procedure","radiation shield",5984,"Synonymous terminology: radiation stent, tongue protector, lead shield.An intraoral prosthesis designed to shield adjacent tissues from radiation during orthovoltage treatment of malignant lesions of the head and neck region."
"Procedure","radiation cone locator",5985,"Synonymous terminology: docking device, cone locator.A prosthesis utilized to direct and reduplicate the path of radiation to an oral tumor during a split course of irradiation."
"Procedure","fluoride gel carrier",5986,"Synonymous terminology: fluoride applicator. A prosthesis, which covers the teeth in either dental arch and is used to apply topical fluoride in close proximity to tooth enamel and dentin for several minutes daily."
"Procedure","commissure splint",5987,"Synonymous terminology: lip splint.A device placed between the lips, which assists in achieving increased opening between the lips. Use of such devices enhances opening where surgical, chemical or electrical alterations of the lips has resulted in severe restriction or contractures."
"Procedure","surgical splint",5988,"Synonymous terminology: Gunning splint, modified Gunning splint, labiolingual splint, fenestrated splint, Kingsley splint, cast metal splint.Splints are designed to utilize existing teeth and/or alveolar processes as points of anchorage to assist in stabilization and immobilization of broken bones during healing. They are used to re-establish, as much as possible, normal occlusal relationships during the process of immobilization. Frequently, existing prostheses (e.g., a patients complete dentures) can be modified to serve as surgical splints. Frequently, surgical splints have arch bars added to facilitate intermaxillary fixation. Rubber elastics may be used to assist in this process. Circummandibular eyelet hooks can be utilized for enhanced stabilization with wiring to adjacent bone."
"Procedure","vesiculobullous disease medicament carrier",5991,"A custom fabricated carrier that covers the teeth and alveolar mucosa, or alveolar mucosa alone, and is used to deliver prescription medicaments for treatment of immunologically mediated vesiculobullous diseases."
"Procedure","adjust maxillofacial prosthetic appliance, by report",5992,
"Procedure","maintenance and cleaning of a maxillofacial prosthesis (extra-or intra-oral) other than required adjustments, by report",5993,
"Procedure","periodontal medicament carrier wit peripheral seal laboratory processed",5994,"A custom fabricated,laboratory processed carrier that coversthe teeth and alveolar mucosa. Used as a vehicle to deliver prescribed medicaments for sustained c ontact with the gingiva, alveolar mucosa, and into the periodontal sulcus or pocket. [This code was deleted in 2021.]"
"Procedure","unspecified maxillofacial prosthesis, by report",5999,"Used for procedure that is not adequately described by a code. Describe procedure."
"Procedure","surgical placement of implant body: endosteal implant",6010,
"Procedure","second stage implant surgery",6011,"Surgical access to an implant body (second stage implant surgery) Surgical access to an implant body for placement of a healing cap or to enable placement of an abutment."
"Procedure","surgical placement of interim implant body for transitional prosthesis: endosteal implant",6012,"Includes removal during later therapy to accommodate the definitive restoration, which may include placement of other implants."
"Procedure","surgical placement of mini implant",6013,
"Procedure","surgical placement: eposteal implant",6040,"An eposteal (subperiosteal) framework of a biocompatible material designed and fabricated to fit on the surface of the bone of the mandible or maxilla with permucosal An eposteal (subperiosteal) framework of a biocompatible material designed and fabricated to fit on the surface of the bone of the mandible or maxilla with permucosal"
"Procedure","surgical placement: transosteal implant",6050,"A transosteal (transosseous) biocompatible device with threaded posts penetrating both the superior and inferior cortical bone plates of the mandibular symphysis and exiting through the permucosa providing support and attachment for a dental prosthesis. Transosteal implants are placed completely through the bone and into the oral cavity from extraoral or intraoral."
"Procedure","interim abutment",6051,"Includes placement and removal. A healing cap is not an interim abutment."
"Procedure","semi-precision attachment abutment",6052,"Includes placement of keeper assembly."
"Procedure","connecting bar implant supported or abutment supported",6055,"Utilized to stabilize and anchor a prosthesis."
"Procedure","prefabricated abutment includes modification and placement",6056,"Modification of a prefabricated abutment may be necessary."
"Procedure","custom fabricated abutment includes placement",6057,"Created by a laboratory process, specific for an individual application."
"Procedure","abutment supported porcelain/ceramic crown",6058,"A single crown restoration that is retained, supported and stabilized by an abutment on an implant."
"Procedure","abutment supported porcelain fused to metal crown (high noble metal)",6059,"A single metal-ceramic crown restoration that is retained, supported and stabilized by an abutment on an implant."
"Procedure","abutment supported porcelain fused to metal crown (predominantly base metal)",6060,"A single metal-ceramic crown restoration that is retained, supported and stabilized by an abutment on an implant."
"Procedure","abutment supported porcelain fused to metal crown (noble metal)",6061,"A single metal-ceramic crown restoration that is retained, supported and stabilized by an abutment on an implant."
"Procedure","abutment supported cast metal crown (high noble metal)",6062,"A single cast metal crown restoration that is retained, supported and stabilized by an abutment on an implant."
"Procedure","abutment supported cast metal crown (predominantly base metal)",6063,"A single cast metal crown restoration that is retained,supported and stabilized by an abutment on an implant."
"Procedure","abutment supported cast metal crown (noble metal)",6064,"A single cast metal crown restoration that is retained, supported and stabilized by an abutment on an implant."
"Procedure","implant supported porcelain/ceramic crown",6065,"A single crown restoration that is retained, supported and stabilized by an implant."
"Procedure","implant supported porcelain fused to metal crown(titanium, titanium alloy, high noble metal)",6066,"A single metal-ceramic crown restoration that is retained, supported and stabilized by an implant."
"Procedure","implant supported metal crown (titanium, titanium alloy, high noble metal)",6067,"A single cast metal or milled crown restoration that is retained, supported and stabilized by an implant."
"Procedure","abutment supported retainer for porcelain/ceramicFPD",6068,"A ceramic retainer for a fixed partial denture that gains retention, support and stability from an abutment on an implant."
"Procedure","abutment supported retainer for porcelain fused to metal FPD (high noble metal)",6069,"A metal-ceramic retainer for a fixed partial denture that gains retention, support and stability from an abutment on an implant."
"Procedure","abutment supported retainer for porcelain fused to metal FPD (predominantly base metal)",6070,"A metal-ceramic retainer for a fixed partial denture that gains retention, support and stability from an abutment on an implant."
"Procedure","abutment supported retainer for porcelain fused to metal FPD (noble metal)",6071,"abutment supported retainer for porcelain fused to metal FPD (noble metal)"
"Procedure","abutment supported retainer for cast metal FPD (high noble metal)",6072,"A cast metal retainer for a fixed partial denture that gains retention, support and stability from an abutment on an implant."
"Procedure","abutment supported retainer for cast metal FPD (predominantly base metal)",6073,"A cast metal retainer for a fixed partial denture that gains retention, support and stability from an abutment on an implant."
"Procedure","abutment supported retainer for cast metal FPD (noble metal)",6074,"A cast metal retainer for a fixed partial denture that gains retention, support and stability from an abutment on an implant."
"Procedure","implant supported retainer for ceramic FPD",6075,"A ceramic retainer for a fixed partial denture that gains retention, support and stability from an implant."
"Procedure","implant supported retainer for porcelain fused to metal FPD (titanium, titanium alloy, or high noble metal)",6076,"A metal-ceramic retainer for a fixed partial denture that gains retention, support and stability from an implant."
